{
 "_perf": {
  "binaries": [],
  "extract_s": 10.0,
  "strings_s": 0.2
 },
 "categories": {
  "acp_methods": [
   "activateTab",
   "authenticate",
   "back",
   "broker_info",
   "browserViewportSet",
   "browserVisibilityGet",
   "browserVisibilitySet",
   "cancelRequest",
   "check",
   "claimTab",
   "click",
   "close",
   "closeSession",
   "codex/browserUse",
   "codex/toolSurface",
   "completion/complete",
   "cuaDrag",
   "cuaKeypress",
   "cuaScroll",
   "domCuaScroll",
   "drag",
   "elementInfo",
   "elicitation/create",
   "evaluate",
   "finalize",
   "finalizeTabs",
   "forward",
   "fs/promises",
   "getDialog",
   "getState",
   "handleDialog",
   "hover",
   "initialize",
   "list",
   "listUserTabs",
   "logging/setLevel",
   "markDeliverable",
   "markHandoff",
   "mcp/list",
   "nameSession",
   "navigate",
   "newTab",
   "notifications/cancelled",
   "notifications/elicitation/complete",
   "notifications/initialized",
   "notifications/message",
   "notifications/progress",
   "notifications/prompts/list_changed",
   "notifications/resources/list_changed",
   "notifications/resources/updated",
   "notifications/roots/list_changed",
   "notifications/subscriptions/acknowledged",
   "notifications/tasks/status",
   "notifications/tools/list_changed",
   "ping",
   "playwright",
   "playwrightWaitForTimeout",
   "press",
   "prompts/get",
   "prompts/list",
   "reload",
   "resources/list",
   "resources/read",
   "resources/subscribe",
   "resources/templates/list",
   "resources/unsubscribe",
   "roots/list",
   "sampling/createMessage",
   "screenshot",
   "scroll",
   "select",
   "server/discover",
   "session/cancelBackgroundTask",
   "session/close",
   "session/compact",
   "session/create",
   "session/event",
   "session/events",
   "session/fork",
   "session/goal",
   "session/list",
   "session/messages",
   "session/read",
   "session/requestRuntimePreferences",
   "session/resume",
   "session/send",
   "session/setMode",
   "session/setModel",
   "session/setThoughtLevel",
   "session/set_model",
   "session/stop",
   "session/subagents",
   "session/subscribe",
   "session/updateRuntimeModelConfig",
   "session/usage",
   "snapshot",
   "subscriptions/listen",
   "tools/bin/avdmanager",
   "tools/bin/sdkmanager",
   "tools/call",
   "tools/list",
   "turnEnded",
   "type",
   "v4/conversation/frame",
   "workspace/generateText",
   "workspace/readState",
   "workspace/removeModelProvider",
   "workspace/setDefaultMode",
   "workspace/setDefaultModel",
   "workspace/setDefaultThoughtLevel",
   "workspace/set_default_model",
   "workspace/updateInteractionPreferences",
   "workspace/updateProviderRegistry",
   "workspace/upsertModelProvider"
  ],
  "bundled_tools": [
   "tools/bfs/bfs: bfs 4.1.1",
   "tools/ripgrep/rg: ripgrep 14.1.1 (rev 4649aa9700)",
   "tools/ugrep/ugrep: ugrep 7.5.0 x86_64-pc-linux-gnu +sse2; -P:pcre2jit; -z:zlib,bzip2,zstd,brotli,7z,tar/pax/cpio/zip"
  ],
  "deps": {
   "@arms/rum-electron": "^0.0.3",
   "@babel/runtime": "^7.24.5",
   "@fiahfy/icns": "^0.0.7",
   "@larksuiteoapi/node-sdk": "1.61.1",
   "@lydell/node-pty-linux-arm64": "1.2.0-beta.10",
   "@lydell/node-pty-linux-x64": "1.2.0-beta.10",
   "@zcode/client": "workspace:*",
   "@zcode/e2e-report": "workspace:*",
   "@zcode/rpc": "workspace:*",
   "@zcode/server": "workspace:*",
   "@zcode/services": "workspace:*",
   "@zcode/shared": "workspace:*",
   "@zcode/ui": "workspace:*",
   "electron-updater": "^6.8.3",
   "module-details-from-path": "^1.0.4",
   "node-forge": "^1.4.0",
   "node-pty": "^1.0.0",
   "playwright-core": "1.59.1",
   "react": "^19.2.4",
   "react-dom": "^19.2.4",
   "semver": "^7.7.4",
   "ssh2": "^1.16.0",
   "undici": "^6.23.0",
   "ws": "^8.20.0",
   "yaml": "^2.9.0",
   "yazl": "^3.3.1"
  },
  "endpoints": [
   "/api/anthropic",
   "/api/auth/tokenByAuthCode",
   "/api/auth/z/login",
   "/api/biz",
   "/api/biz/customer/getCustomerInfo",
   "/api/biz/subscription/list",
   "/api/intranet/probe",
   "/api/monitor/usage/quota/limit",
   "/api/oauth/authorize",
   "/api/oauth/userinfo",
   "/api/pay",
   "/api/rpc-host-capability",
   "/api/server-info",
   "/api/v1",
   "/api/v1/agent/configs",
   "/api/v1/client/configs",
   "/api/v1/oauth/token",
   "/api/v1/off-peak/anthropic/v1/messages",
   "/api/v1/off-peak/ticket",
   "/api/v1/off-peak/ticket/availability",
   "/api/v1/off-peak/ticket/status",
   "/api/v1/releases/electron/manifest",
   "/api/v1/snapshot/upload-credential",
   "/api/v2/releases/latest",
   "/authorize",
   "/oauth/",
   "/oauth/callback/bigmodel",
   "/oauth/v1/app/registration",
   "/subscription/enterprise/v2/order",
   "/subscription/enterprise/v2/order/calculate",
   "/token",
   "/v1/messages",
   "/ws/host",
   "http://127.0.0.1",
   "http://127.0.0.1:1234/v1",
   "http://127.0.0.1:1337/v1",
   "http://127.0.0.1:7890",
   "http://192.168.6.166:8080",
   "http://192.168.6.166:8080/my",
   "http://docx/",
   "http://fb.me/use-check-prop-types",
   "http://get.webgl.org",
   "http://github.com/Constellation",
   "http://github.com/estools/escodegen",
   "http://github.com/estools/escodegen.git",
   "http://localhost/",
   "http://localhost:4318/",
   "http://localhost:8080/v1",
   "http://ns.adobe.com/xdp/",
   "http://ns.adobe.com/xdp/pdf/",
   "http://ns.adobe.com/xfdf/",
   "http://ns.adobe.com/xmpmeta/",
   "http://schemas.android.com/apk/res/android",
   "http://schemas.microsoft.com/office/2007/relationships/stylesWithEffects",
   "http://schemas.microsoft.com/office/2011/relationships/chartColorStyle",
   "http://schemas.microsoft.com/office/2011/relationships/chartStyle",
   "http://schemas.microsoft.com/office/2011/relationships/commentsExtended",
   "http://schemas.microsoft.com/office/2014/relationships/chartEx",
   "http://schemas.openxmlformats.org/drawingml/2006/chart",
   "http://schemas.openxmlformats.org/drawingml/2006/main",
   "http://schemas.openxmlformats.org/officeDocument/2006/relationships",
   "http://schemas.openxmlformats.org/officeDocument/2006/relationships/aFChunk",
   "http://schemas.openxmlformats.org/officeDocument/2006/relationships/chart",
   "http://schemas.openxmlformats.org/officeDocument/2006/relationships/comments",
   "http://schemas.openxmlformats.org/officeDocument/2006/relationships/drawing",
   "http://schemas.openxmlformats.org/officeDocument/2006/relationships/endnotes",
   "http://schemas.openxmlformats.org/officeDocument/2006/relationships/extended-properties",
   "http://schemas.openxmlformats.org/officeDocument/2006/relationships/fontTable",
   "http://schemas.openxmlformats.org/officeDocument/2006/relationships/footer",
   "http://schemas.openxmlformats.org/officeDocument/2006/relationships/footnotes",
   "http://schemas.openxmlformats.org/officeDocument/2006/relationships/header",
   "http://schemas.openxmlformats.org/officeDocument/2006/relationships/hyperlink",
   "http://schemas.openxmlformats.org/officeDocument/2006/relationships/image",
   "http://schemas.openxmlformats.org/officeDocument/2006/relationships/numbering",
   "http://schemas.openxmlformats.org/officeDocument/2006/relationships/officeDocument",
   "http://schemas.openxmlformats.org/officeDocument/2006/relationships/settings",
   "http://schemas.openxmlformats.org/officeDocument/2006/relationships/styles",
   "http://schemas.openxmlformats.org/officeDocument/2006/relationships/theme",
   "http://schemas.openxmlformats.org/officeDocument/2006/relationships/webSettings",
   "http://schemas.openxmlformats.org/package/2006/content-types",
   "http://schemas.openxmlformats.org/package/2006/relationships",
   "http://schemas.openxmlformats.org/package/2006/relationships/metadata/core-properties",
   "http://schemas.openxmlformats.org/package/2006/relationships/metadata/custom-properties",
   "http://schemas.openxmlformats.org/spreadsheetml/2006/main",
   "http://schemas.openxmlformats.org/wordprocessingml/2006/main",
   "http://studio.zcode-ai.com:12345/ssh-remote-assets",
   "http://www.apple.com/DTDs/PropertyList-1.0.dtd",
   "http://www.ibm.com/data/dtd/v11/ibmxhtml1-transitional.dtd",
   "http://www.xfa.org/schema/xci/",
   "http://www.xfa.org/schema/xdc/",
   "http://www.xfa.org/schema/xfa-connection-set/",
   "http://www.xfa.org/schema/xfa-data/",
   "http://www.xfa.org/schema/xfa-data/1.0/",
   "http://www.xfa.org/schema/xfa-form/",
   "http://www.xfa.org/schema/xfa-locale-set/",
   "http://www.xfa.org/schema/xfa-source-set/",
   "http://www.xfa.org/schema/xfa-template/",
   "https://abacus.ai/help/api",
   "https://accounts.feishu.cn",
   "https://accounts.larksuite.com",
   "https://ai-gateway.helicone.ai/v1",
   "https://ai-gateway.vercel.sh/v3/ai",
   "https://ai-sdk.dev/unauthenticated-ai-gateway",
   "https://ai.google.dev/gemini-api/docs/models",
   "https://alipaytbox.yuque.com/sxs0ba/ling/intro",
   "https://ambient.xyz",
   "https://api-docs.deepseek.com/quick_start/pricing",
   "https://api-inference.modelscope.cn/v1",
   "https://api-sherlock.cloudferro.com/openai/v1/",
   "https://api.302.ai/v1",
   "https://api.abliteration.ai/v1",
   "https://api.ambient.xyz/v1",
   "https://api.anthropic.com",
   "https://api.anthropic.com/v1",
   "https://api.auriko.ai/v1",
   "https://api.berget.ai",
   "https://api.berget.ai/v1",
   "https://api.chatglm.site",
   "https://api.clarifai.com/v2/ext/openai/v1",
   "https://api.claudin.io/v1",
   "https://api.cloudflare.com/client/v4/accounts/{}/ai/v1",
   "https://api.code.umans.ai/v1",
   "https://api.cortecs.ai/v1",
   "https://api.cortecs.ai/v1/models",
   "https://api.deepseek.com",
   "https://api.dinference.com/v1",
   "https://api.fireworks.ai/inference/v1/",
   "https://api.friendli.ai/serverless/v1",
   "https://api.getlilac.com/v1",
   "https://api.github.com/repos/{}/{}/zipball/${encodeURIComponent",
   "https://api.githubcopilot.com",
   "https://api.gmi-serving.com/v1",
   "https://api.hpc-ai.com/inference/v1",
   "https://api.inceptionlabs.ai/v1/",